{
  "version": "0.1.0",
  "generatedAt": "2026-09-13T01:19:26.795Z",
  "baseLicense": "CC-BY-SA-4.0",
  "attribution": {
    "title": "Z-Anatomy — The libre 3D atlas of anatomy",
    "source": "Z-Anatomy",
    "sourceUrl": "https://github.com/Z-Anatomy/Models-of-human-anatomy.git",
    "sourceCommit": "99cb24253f09e63dd99602da7e1ef7204aecf648",
    "derivedFrom": "BodyParts3D",
    "license": "CC BY-SA 4.0",
    "licenseUrl": "https://creativecommons.org/licenses/by-sa/4.0/",
    "modifications": [
      "skeleton: sin decimación Blender; rótulos excluidos; gltfpack -cc -tc -kn (sin -si)",
      "viscera: sin decimación Blender; rótulos excluidos; gltfpack -cc -tc -kn (sin -si)"
    ],
    "citationText": "Atlas 3D de Biomapa basado en Z-Anatomy — The libre 3D atlas of anatomy (Gauthier Kervyn, diseño/3D/anatomía; Marcin Zielinski, add-on Blender), derivado de BodyParts3D — The Database Center for Life Science (Kousaku Okubo), CC BY-SA 4.0. Modelos de referencia adicionales según ATTRIBUTIONS.md de Z-Anatomy."
  },
  "systems": [
    {
      "id": "skin",
      "label": "Piel",
      "file": null,
      "bytes": 0,
      "sha256": null,
      "meshCount": 0,
      "meshNames": [],
      "defaultVisible": false,
      "order": 1
    },
    {
      "id": "muscles",
      "label": "Músculos",
      "file": null,
      "bytes": 0,
      "sha256": null,
      "meshCount": 0,
      "meshNames": [],
      "defaultVisible": false,
      "order": 2
    },
    {
      "id": "skeleton",
      "label": "Huesos",
      "file": "skeleton.glb",
      "bytes": 2029040,
      "sha256": "7b33eda3d5af7486f76ec7afbbb30ae3c4570e50b121d16d1faec592772dbdeb",
      "meshCount": 329,
      "meshNames": [
        "Anterior longitudinal ligament",
        "Arytenoid cartilage.l",
        "Arytenoid cartilage.r",
        "Atlas (C1)",
        "Axis (C2)",
        "Body of sternum",
        "Calcaneus.l",
        "Calcaneus.r",
        "Capitate bone.l",
        "Capitate bone.r",
        "Clavicle.l",
        "Clavicle.r",
        "Coccyx",
        "Corniculate cartilage.l",
        "Corniculate cartilage.r",
        "Costal cartilage of eighth rib.l",
        "Costal cartilage of eighth rib.r",
        "Costal cartilage of fifth rib.l",
        "Costal cartilage of fifth rib.r",
        "Costal cartilage of first rib.l",
        "Costal cartilage of first rib.r",
        "Costal cartilage of fourth rib.l",
        "Costal cartilage of fourth rib.r",
        "Costal cartilage of ninth rib.l",
        "Costal cartilage of ninth rib.r",
        "Costal cartilage of second rib.l",
        "Costal cartilage of second rib.r",
        "Costal cartilage of seventh rib.l",
        "Costal cartilage of seventh rib.r",
        "Costal cartilage of sixth rib.l",
        "Costal cartilage of sixth rib.r",
        "Costal cartilage of tenth rib.l",
        "Costal cartilage of tenth rib.r",
        "Costal cartilage of third rib.l",
        "Costal cartilage of third rib.r",
        "Cricoid cartilage",
        "Cuboid bone.l",
        "Cuboid bone.r",
        "Distal phalanx of fifth finger of foot.l",
        "Distal phalanx of fifth finger of foot.r",
        "Distal phalanx of fifth finger of hand.l",
        "Distal phalanx of fifth finger of hand.r",
        "Distal phalanx of first finger of foot.l",
        "Distal phalanx of first finger of foot.r",
        "Distal phalanx of first finger of hand.l",
        "Distal phalanx of first finger of hand.r",
        "Distal phalanx of fourth finger of foot.l",
        "Distal phalanx of fourth finger of foot.r",
        "Distal phalanx of fourth finger of hand.l",
        "Distal phalanx of fourth finger of hand.r",
        "Distal phalanx of second finger of foot.l",
        "Distal phalanx of second finger of foot.r",
        "Distal phalanx of second finger of hand.l",
        "Distal phalanx of second finger of hand.r",
        "Distal phalanx of third finger of foot.l",
        "Distal phalanx of third finger of foot.r",
        "Distal phalanx of third finger of hand.l",
        "Distal phalanx of third finger of hand.r",
        "Eighth rib.l",
        "Eighth rib.r",
        "Eleventh rib.l",
        "Eleventh rib.r",
        "Ethmoid bone",
        "Femur.l",
        "Femur.r",
        "Fibula.l",
        "Fibula.r",
        "Fifth metacarpal bone.l",
        "Fifth metacarpal bone.r",
        "Fifth metatarsal bone.l",
        "Fifth metatarsal bone.r",
        "Fifth rib.l",
        "Fifth rib.r",
        "First metacarpal bone.l",
        "First metacarpal bone.r",
        "First metatarsal bone.l",
        "First metatarsal bone.r",
        "First rib.l",
        "First rib.r",
        "Fourth metacarpal bone.l",
        "Fourth metacarpal bone.r",
        "Fourth metatarsal bone.l",
        "Fourth metatarsal bone.r",
        "Fourth rib.l",
        "Fourth rib.r",
        "Frontal bone",
        "Hamate bone.l",
        "Hamate bone.r",
        "Hip bone.l",
        "Hip bone.r",
        "Humerus.l",
        "Humerus.r",
        "Hyoid bone",
        "Incus.l",
        "Incus.r",
        "Inferior nasal concha bone.l",
        "Inferior nasal concha bone.r",
        "Intermediate cuneiform bone.l",
        "Intermediate cuneiform bone.r",
        "Interspinous ligaments",
        "Intertransverse ligaments.l",
        "Intertransverse ligaments.r",
        "Intervertebral disc C2-C3",
        "Intervertebral disc C3-C4",
        "Intervertebral disc C4-C5",
        "Intervertebral disc C5-C6",
        "Intervertebral disc C6-C7",
        "Intervertebral disc C7-T1",
        "Intervertebral disc L1-L2",
        "Intervertebral disc L2-L3",
        "Intervertebral disc L3-L4",
        "Intervertebral disc L4-L5",
        "Intervertebral disc L5-S1",
        "Intervertebral disc T1-T2",
        "Intervertebral disc T10-T11",
        "Intervertebral disc T11-T12",
        "Intervertebral disc T12-L1",
        "Intervertebral disc T2-T3",
        "Intervertebral disc T3-T4",
        "Intervertebral disc T4-T5",
        "Intervertebral disc T5-T6",
        "Intervertebral disc T6-T7",
        "Intervertebral disc T7-T8",
        "Intervertebral disc T8-T9",
        "Intervertebral disc T9-T10",
        "Intra-articular ligament of head of rib",
        "Intra-articular ligament of head of rib.r",
        "Lacrimal bone.l",
        "Lacrimal bone.r",
        "Lateral cuneiform bone.l",
        "Lateral cuneiform bone.r",
        "Lateral process of nasal septal cartilage.l",
        "Lateral process of nasal septal cartilage.r",
        "Ligamenta flava",
        "Lower canine.l",
        "Lower canine.r",
        "Lower first molar tooth.l",
        "Lower first molar tooth.r",
        "Lower first premolar.l",
        "Lower first premolar.r",
        "Lower lateral incisor.l",
        "Lower lateral incisor.r",
        "Lower medial incisor.l",
        "Lower medial incisor.r",
        "Lower second molar tooth.l",
        "Lower second molar tooth.r",
        "Lower second premolar.l",
        "Lower second premolar.r",
        "Lunate bone.l",
        "Lunate bone.r",
        "Major alar cartilage.l",
        "Major alar cartilage.r",
        "Malleus.l",
        "Malleus.r",
        "Mandible",
        "Manubrium of sternum",
        "Maxilla.l",
        "Maxilla.r",
        "Medial cuneiform bone.l",
        "Medial cuneiform bone.r",
        "Middle phalanx of fifth finger of foot.l",
        "Middle phalanx of fifth finger of foot.r",
        "Middle phalanx of fifth finger of hand.l",
        "Middle phalanx of fifth finger of hand.r",
        "Middle phalanx of fourth finger of foot.l",
        "Middle phalanx of fourth finger of foot.r",
        "Middle phalanx of fourth finger of hand.l",
        "Middle phalanx of fourth finger of hand.r",
        "Middle phalanx of second finger of foot.l",
        "Middle phalanx of second finger of foot.r",
        "Middle phalanx of second finger of hand.l",
        "Middle phalanx of second finger of hand.r",
        "Middle phalanx of third finger of foot.l",
        "Middle phalanx of third finger of foot.r",
        "Middle phalanx of third finger of hand.l",
        "Middle phalanx of third finger of hand.r",
        "Nasal bone.l",
        "Nasal bone.r",
        "Nasal septal cartilage",
        "Navicular bone.l",
        "Navicular bone.r",
        "Ninth rib.l",
        "Ninth rib.r",
        "Nuchal ligament",
        "Nucleus pulposus C2-C3",
        "Nucleus pulposus C3-C4",
        "Nucleus pulposus C4-C5",
        "Nucleus pulposus C5-C6",
        "Nucleus pulposus C6-C7",
        "Nucleus pulposus C7-T1",
        "Nucleus pulposus L1-L2",
        "Nucleus pulposus L2-L3",
        "Nucleus pulposus L3-L4",
        "Nucleus pulposus L4-L5",
        "Nucleus pulposus L5-S1",
        "Nucleus pulposus T1-T2",
        "Nucleus pulposus T10-T11",
        "Nucleus pulposus T11-T12",
        "Nucleus pulposus T12-L1",
        "Nucleus pulposus T2-T3",
        "Nucleus pulposus T3-T4",
        "Nucleus pulposus T4-T5",
        "Nucleus pulposus T5-T6",
        "Nucleus pulposus T6-T7",
        "Nucleus pulposus T7-T8",
        "Nucleus pulposus T8-T9",
        "Nucleus pulposus T9-T10",
        "Occipital bone",
        "Palatine bone.l",
        "Palatine bone.r",
        "Parietal bone.l",
        "Parietal bone.r",
        "Patella.l",
        "Patella.r",
        "Pisiform bone.l",
        "Pisiform bone.r",
        "Posterior longitudinal ligament",
        "Proximal phalanx of fifth finger of foot.l",
        "Proximal phalanx of fifth finger of foot.r",
        "Proximal phalanx of fifth finger of hand.l",
        "Proximal phalanx of fifth finger of hand.r",
        "Proximal phalanx of first finger of foot.l",
        "Proximal phalanx of first finger of foot.r",
        "Proximal phalanx of first finger of hand.l",
        "Proximal phalanx of first finger of hand.r",